{
  "schema": "shellx-motion/rendering-sample-catalog@1",
  "revision": 3,
  "scope": "delivery-output-foundation",
  "authoritativeCapabilitySet": {
    "schema": "shellx-motion/published-rendering-capability-set@1",
    "definition": "The delivery-output foundation covers every documented preview lane, each shipped export preset on the browser final route, the documented native still and native H.264 routes, the admitted GPU H.264 route, and the public mixed-preset batch route. Its primary MotionLayerType mapping is a discovery aid, not a complete public authoring-mutation or tool inventory.",
    "sources": [
      "docs/public/rendering.md",
      "packages/core/src/export-presets.ts",
      "packages/core/src/types.ts",
      "docs/public/rendering-sample-family-authorities.json",
      "schemas/rendering-sample-family-authorities.schema.json"
    ],
    "primaryLayerTypeFamilies": [
      { "layerType": "text", "familyId": "family.2d-geometry-text-keyframes@1" },
      { "layerType": "shape", "familyId": "family.2d-geometry-text-keyframes@1" },
      { "layerType": "image", "familyId": "family.keying-and-roto@1" },
      { "layerType": "video", "familyId": "family.tracking-and-stabilization@1" },
      { "layerType": "caption", "familyId": "family.caption-import-and-delivery@1" },
      { "layerType": "audio", "familyId": "family.audio-delivery@1" },
      { "layerType": "web", "familyId": "family.html-css-and-canvas@1" },
      { "layerType": "html", "familyId": "family.html-css-and-canvas@1" },
      { "layerType": "canvas", "familyId": "family.html-css-and-canvas@1" },
      { "layerType": "adjustment", "familyId": "family.governed-shader-and-hybrid-gpu-delivery@1" },
      { "layerType": "camera", "familyId": "family.environments-and-depth@1" },
      { "layerType": "particles", "familyId": "family.points-particles-trails@1" },
      { "layerType": "points", "familyId": "family.points-particles-trails@1" },
      { "layerType": "shader", "familyId": "family.governed-shader-and-hybrid-gpu-delivery@1" },
      { "layerType": "scene3d", "familyId": "family.fixed-scene3d-and-gltf@1" },
      { "layerType": "environment", "familyId": "family.environments-and-depth@1" },
      { "layerType": "group", "familyId": "family.cutout-rig-bake@1" }
    ]
  },
  "publicExport": {
    "schemaPath": "schemas/rendering-sample-catalog.schema.json",
    "catalogPath": "docs/public/rendering-sample-catalog.json",
    "documentationPath": "docs/public/RENDERING_SAMPLES.md"
  },
  "capabilities": [
    {
      "id": "preview.native-png@1",
      "title": "Native PNG preview",
      "surface": "preview",
      "requiredCompatibilityLanes": ["native"],
      "documentation": { "path": "docs/public/rendering.md", "anchor": "choosing-a-lane" }
    },
    {
      "id": "preview.browser-png@1",
      "title": "Browser PNG preview",
      "surface": "preview",
      "requiredCompatibilityLanes": ["browser"],
      "documentation": { "path": "docs/public/rendering.md", "anchor": "choosing-a-lane" }
    },
    {
      "id": "preview.gpu-png@1",
      "title": "Strict GPU PNG preview",
      "surface": "preview",
      "requiredCompatibilityLanes": ["gpu"],
      "documentation": { "path": "docs/public/rendering.md", "anchor": "choosing-a-lane" }
    },
    {
      "id": "render.native-png-still@1",
      "title": "Native PNG still",
      "surface": "render",
      "requiredCompatibilityLanes": ["native"],
      "documentation": { "path": "docs/public/rendering.md", "anchor": "choosing-a-lane" }
    },
    {
      "id": "render.native-mp4-h264@1",
      "title": "Native-frame H.264 MP4",
      "surface": "render",
      "requiredCompatibilityLanes": ["native"],
      "documentation": { "path": "docs/public/rendering.md", "anchor": "choosing-a-lane" }
    },
    {
      "id": "render.browser-mp4-h264@1",
      "title": "Browser-frame H.264 MP4",
      "surface": "render",
      "requiredCompatibilityLanes": ["browser"],
      "documentation": { "path": "docs/public/rendering.md", "anchor": "choosing-a-lane" }
    },
    {
      "id": "render.browser-mp4-hevc@1",
      "title": "Browser-frame HEVC MP4",
      "surface": "render",
      "requiredCompatibilityLanes": ["browser"],
      "documentation": { "path": "docs/public/rendering.md", "anchor": "choosing-a-lane" }
    },
    {
      "id": "render.browser-webm-av1@1",
      "title": "Browser-frame AV1 WebM",
      "surface": "render",
      "requiredCompatibilityLanes": ["browser"],
      "documentation": { "path": "docs/public/rendering.md", "anchor": "choosing-a-lane" }
    },
    {
      "id": "render.browser-webm-vp9@1",
      "title": "Browser-frame VP9 WebM",
      "surface": "render",
      "requiredCompatibilityLanes": ["browser"],
      "documentation": { "path": "docs/public/rendering.md", "anchor": "choosing-a-lane" }
    },
    {
      "id": "render.browser-webm-vp9-alpha@1",
      "title": "Browser-frame VP9-alpha WebM",
      "surface": "render",
      "requiredCompatibilityLanes": ["browser"],
      "documentation": { "path": "docs/public/rendering.md", "anchor": "choosing-a-lane" }
    },
    {
      "id": "render.browser-gif@1",
      "title": "Browser-frame GIF",
      "surface": "render",
      "requiredCompatibilityLanes": ["browser"],
      "documentation": { "path": "docs/public/rendering.md", "anchor": "choosing-a-lane" }
    },
    {
      "id": "render.browser-mov-prores@1",
      "title": "Browser-frame ProRes 4444 MOV",
      "surface": "render",
      "requiredCompatibilityLanes": ["browser"],
      "documentation": { "path": "docs/public/rendering.md", "anchor": "choosing-a-lane" }
    },
    {
      "id": "render.browser-png-sequence@1",
      "title": "Browser-frame PNG sequence",
      "surface": "render",
      "requiredCompatibilityLanes": ["browser"],
      "documentation": { "path": "docs/public/rendering.md", "anchor": "choosing-a-lane" }
    },
    {
      "id": "render.browser-png-frame@1",
      "title": "Browser-frame PNG still",
      "surface": "render",
      "requiredCompatibilityLanes": ["browser"],
      "documentation": { "path": "docs/public/rendering.md", "anchor": "choosing-a-lane" }
    },
    {
      "id": "render.browser-jpeg-frame@1",
      "title": "Browser-frame JPEG still",
      "surface": "render",
      "requiredCompatibilityLanes": ["browser"],
      "documentation": { "path": "docs/public/rendering.md", "anchor": "choosing-a-lane" }
    },
    {
      "id": "render.gpu-mp4-h264@1",
      "title": "Strict GPU H.264 MP4",
      "surface": "render",
      "requiredCompatibilityLanes": ["gpu"],
      "documentation": { "path": "docs/public/rendering.md", "anchor": "choosing-a-lane" }
    },
    {
      "id": "render-batch.mixed-preset@1",
      "title": "Mixed-preset batch render",
      "surface": "render-batch",
      "requiredCompatibilityLanes": ["browser"],
      "documentation": { "path": "docs/public/rendering.md", "anchor": "choosing-a-lane" }
    }
  ],
  "samples": [
    {
      "id": "sample.procedural-relationships.native-preview@1",
      "capabilityId": "preview.native-png@1",
      "title": "Text-free native preview",
      "source": { "kind": "motion-package", "path": "fixtures/packages/procedural-relationships", "fingerprint": "5c92b49c252bbfaa8ea81ea59c69be9508056ac3a04ab303cdb80a3dc2df61d5" },
      "invocation": {
        "sourceCheckout": ["pnpm", "--filter", "@shellx-motion/cli", "run", "cli", "--", "preview", "{samplePath}", "--lane", "native", "--at-ms", "1000", "--out", "{out}/preview-native"],
        "installed": ["shellx-motion", "preview", "{packageRoot}", "--lane", "native", "--at-ms", "1000", "--out", "{out}/preview-native"]
      },
      "expectedArtifact": { "kind": "file", "path": ".scratch/rendering-samples/preview-native/pkg_procedural_relationships-native-1000.png", "mediaType": "image/png" },
      "expectedReceipt": { "schema": "shellx-motion/receipt@1", "operation": "preview.frame", "location": "beside-output" },
      "limitations": "Native is a bounded renderer; it refuses unsupported visual features and never falls back to browser pixels."
    },
    {
      "id": "sample.keyframed-lower-third.browser-preview@1",
      "capabilityId": "preview.browser-png@1",
      "title": "Browser preview",
      "source": { "kind": "motion-package", "path": "fixtures/packages/keyframed-lower-third", "fingerprint": "4cfc9e55fb742b6a9b96fc16f5fa38f01973d6f3793175b3c56600b232931389" },
      "invocation": {
        "sourceCheckout": ["pnpm", "--filter", "@shellx-motion/cli", "run", "cli", "--", "preview", "{samplePath}", "--lane", "browser", "--at-ms", "750", "--out", "{out}/preview-browser"],
        "installed": ["shellx-motion", "preview", "{packageRoot}", "--lane", "browser", "--at-ms", "750", "--out", "{out}/preview-browser"]
      },
      "expectedArtifact": { "kind": "file", "path": ".scratch/rendering-samples/preview-browser/pkg_keyframed_lower_third-browser-750.png", "mediaType": "image/png" },
      "expectedReceipt": { "schema": "shellx-motion/receipt@1", "operation": "preview.frame", "location": "beside-output" },
      "limitations": "Browser preview needs a discovered Chromium runtime and is not evidence of native or GPU pixel parity."
    },
    {
      "id": "sample.gpu-points-preview@1",
      "capabilityId": "preview.gpu-png@1",
      "title": "Strict GPU points preview",
      "source": { "kind": "motion-package", "path": "fixtures/packages/gpu-points-preview", "fingerprint": "896bbe040dabfd54a0f6aa40020f864ccd053a0a80b273204b846977629d7fd5" },
      "invocation": {
        "sourceCheckout": ["pnpm", "--filter", "@shellx-motion/cli", "run", "cli", "--", "preview", "{samplePath}", "--lane", "gpu", "--at-ms", "500", "--out", "{out}/preview-gpu"],
        "installed": ["shellx-motion", "preview", "{packageRoot}", "--lane", "gpu", "--at-ms", "500", "--out", "{out}/preview-gpu"]
      },